[
    {
        "name": "CITATION.cff Harvester",
        "description": "Harvest plugin for CITATION.cff files.",
        "author": "Hermes team",
        "steps": ["harvest"],
        "harvested_files": ["CITATION.cff"],
        "builtin": true
    },
    {
        "name": "codemeta.json Harvester",
        "description": "Harvest plugin for codemeta.json files.",
        "author": "Hermes team",
        "steps": ["harvest"],
        "harvested_files": ["codemeta.json"],
        "builtin": true
    },
    {
        "name": "hermes-plugin-git",
        "description": "Harvest plugin for Git repository metadata.",
        "author": "Hermes team",
        "steps": ["harvest"],
        "repository_url": "https://github.com/softwarepub/hermes-plugin-git"
    },
    {
        "name": "hermes-plugin-python",
        "description": "Harvest plugin for .toml files.",
        "author": "Hermes team",
        "steps": ["harvest"],
        "harvested_files": ["pyproject.toml"],
        "repository_url": "https://github.com/softwarepub/hermes-plugin-python",
        "pypi_url": "https://pypi.org/project/hermes-plugin-python/"
    },
    {
        "name": "Basic processor",
        "description": "Process plugin for basic merging of metadata (for Schema and Codemeta).",
        "author": "Hermes team",
        "steps": ["process"],
        "builtin": true
    },
    {
        "name": "Invenio processor",
        "description": "Process plugin for merging of metadata for Invenio deposit (use with 'Basic processor', this plugin should be used with higher priority).",
        "author": "Hermes team",
        "steps": ["process"],
        "builtin": true
    },
    {
        "name": "Curate",
        "description": "Curation plugin for no-check acceptance of the metadata.",
        "author": "Hermes team",
        "steps": ["curate"],
        "builtin": true
    },
    {
        "name": "File Deposit",
        "description": "Deposit plugin that only dumps the metadata into a local file.",
        "author": "Hermes team",
        "steps": ["deposit"],
        "builtin": true
    },
    {
        "name": "Invenio Deposit",
        "description": "Deposit plugin for Invenio-based platforms.",
        "author": "Hermes team",
        "steps": ["deposit"],
        "builtin": true
    },
    {
        "name": "Invenio RDM Deposit",
        "description": "Deposit plugin for Invenio RDM-based platforms such as Zenodo.",
        "author": "Hermes team",
        "steps": ["deposit"],
        "builtin": true
    },
    {
        "name": "Rodare Deposit",
        "description": "Deposit plugin for the Rodare publication platform at HZDR.",
        "author": "Hermes team",
        "steps": ["deposit"],
        "builtin": true
    },
    {
        "name": "Invenio Postprocess",
        "author": "Hermes team",
        "steps": ["postprocess"],
        "builtin": true
    },
    {
        "name": "Invenio RDM Postprocess",
        "author": "Hermes team",
        "steps": ["postprocess"],
        "builtin": true
    }
]
